I3: Book Type | J3: Book Type | K3: Photo Book | Q3: Mega Book
J4: Papaper & Sizes | K4: 8 x 24 | L4: 10 x 28 | M4: 12 x 24 | N4: 12 x 30 | O4: 12 x 36 | P4: 17 x 24 | Q4: 13 x 40 | R4: 14 x 28 | S4: 14 x 36 | T4: 14 x 40 | U4: 20 x 28 | V4: 18 x 36 | W4: 18 x 40 | X4: 18 x 48 | Y4: 20 x 60 | Z4: 30 x 40 | AA4: L 12 x 24 | AB4: L 12 x 29 | AC4: L 16 x 24 | AD4: L 18 x 24 | AE4: L 15 x 29 | AF4: L 20 x 29
A5: Book Type | B5: PhotoBook | I5: PhotoBook | J5: Royal Glossy / Matt | K5: 20 | L5: 20 | M5: 30 | N5: 30 | O5: 30 | P5: 30 | Q5: 37 | R5: 37 | S5: 37 | T5: 37 | U5: 37 | V5: 75 | W5: 75 | X5: 75 | Y5: 90 | Z5: 90
A6: Size | B6: 12 x 30 | C6: Qunt. | D6: Rate | E6: Total | I6: MegaBook | J6: Royal Velvet | K6: 26 | L6: 26 | M6: 38 | N6: 38 | O6: 38 | P6: 38 | Q6: 47 | R6: 47 | S6: 47 | T6: 47 | U6: 47 | V6: 95 | W6: 95 | X6: 95 | Y6: 110 | Z6: 110
A7: Paper | B7: L Natural | C7: 20 | D7: =INDEX($K$4:$AF$27,MATCH(B7,$J$4:$J$27,0),MATCH(B6,$K$4:$AF$4,0)) -> 0 | E7: =D7*C7 -> 0 | I7: Lay_Flat_Binding | J7: NT Glossy / Matt | K7: 25 | L7: 25 | M7: 35 | N7: 35 | O7: 35 | P7: 35 | Q7: 45 | R7: 45 | S7: 45 | T7: 45 | U7: 45 | V7: 90 | W7: 90 | X7: 90 | Y7: 110 | Z7: 110
B8: TP | C8: 1 | D8: =D7 -> 0 | E8: =D8*C8 -> 0 | J8: NT Velvet | K8: 31 | L8: 31 | M8: 43 | N8: 43 | O8: 43 | P8: 43 | Q8: 55 | R8: 55 | S8: 55 | T8: 55 | U8: 55 | V8: 110 | W8: 110 | X8: 110 | Y8: 130 | Z8: 130
A9: Emboss | B9: Regular Emboss | D9: =INDEX($K$4:$AF$27,MATCH(B9,$J$4:$J$27,0),MATCH(B6,$K$4:$AF$4,0)) -> 170 | E9: =D9*C9 -> 0 | J9: NT Thick Glossy / Matt | K9: 30 | L9: 30 | M9: 40 | N9: 40 | O9: 40 | P9: 40 | Q9: 50 | R9: 50 | S9: 50 | T9: 50 | U9: 50 | V9: 100 | W9: 100 | X9: 100 | Y9: 130 | Z9: 130
A10: Binding | B10: Making Charge | C10: 1 | D10: =INDEX($K$4:$AF$27,MATCH(B10,$J$4:$J$27,0),MATCH(B6,$K$4:$AF$4,0)) -> 350 | E10: =D10*C10 -> 350 | J10: NT Thick Velvet | K10: 36 | L10: 36 | M10: 48 | N10: 48 | O10: 48 | P10: 48 | Q10: 60 | R10: 60 | S10: 60 | T10: 60 | U10: 60 | V10: 120 | W10: 120 | X10: 120 | Y10: 150 | Z10: 150
B11: Minibook | J11: Luster / Photo Matt | K11: 50 | L11: 50 | M11: 80 | N11: 80 | O11: 80 | P11: 80 | Q11: 90 | R11: 90 | S11: 90 | T11: 90 | U11: 90 | V11: 180 | W11: 180 | X11: 180 | Y11: 200 | Z11: 200
B12: Calendar | J12: Natural | K12: 35 | L12: 35 | M12: 50 | N12: 50 | O12: 50 | P12: 50 | Q12: 60 | R12: 60 | S12: 60 | T12: 60 | U12: 60 | V12: 120 | W12: 120 | X12: 120 | Y12: 140 | Z12: 140
A13: Bag | J13: Pearl Metallic | K13: 70 | L13: 70 | M13: 100 | N13: 100 | O13: 100 | P13: 100 | Q13: 120 | R13: 120 | S13: 120 | T13: 120 | U13: 120 | V13: 240 | W13: 240 | X13: 240 | Y13: 260 | Z13: 260
A14: Bag Pad | J14: NT / Dual Metallic | K14: 50 | L14: 50 | M14: 80 | N14: 80 | O14: 80 | P14: 80 | Q14: 90 | R14: 90 | S14: 90 | T14: 90 | U14: 90 | V14: 180 | W14: 180 | X14: 180 | Y14: 200 | Z14: 200
A15: Parcel | B15: Gujarat | C15: 1 | D15: =INDEX($K$4:$AF$27,MATCH(B15,$J$4:$J$27,0),MATCH(B6,$K$4:$AF$4,0)) -> 120 | E15: =D15*C15 -> 120 | J15: L Natural | AA15: 80 | AB15: 80 | AC15: 90 | AD15: 90 | AE15: 100 | AF15: 100
E16: =D16*C16 -> 0 | J16: L Luster | AA16: 120 | AB16: 120 | AC16: 140 | AD16: 140 | AE16: 150 | AF16: 150
E17: =D17*C17 -> 0 | J17: L Pearl Metallic | AA17: 150 | AB17: 150 | AC17: 170 | AD17: 170 | AE17: 190 | AF17: 190
J18: Regular Emboss | M18: 170 | N18: 170 | O18: 170 | P18: 170 | Q18: 200 | R18: 200 | S18: 200 | T18: 200 | U18: 200 | V18: 300 | W18: 300 | X18: 300 | Y18: 300 | Z18: 300
J19: Metallic Emboss | M19: 200 | N19: 200 | O19: 200 | P19: 200 | Q19: 250 | R19: 250 | S19: 250 | T19: 250 | U19: 250 | V19: 350 | W19: 350 | X19: 350 | Y19: 350 | Z19: 350
J20: Gold Foil Emboss | M20: 300 | N20: 300 | O20: 300 | P20: 300 | Q20: 350 | R20: 350 | S20: 350 | T20: 350 | U20: 350 | V20: 450 | W20: 450 | X20: 450 | Y20: 450 | Z20: 450
J21: Making Charge | K21: 300 | L21: 300 | M21: 350 | N21: 350 | O21: 350 | P21: 350 | Q21: 450 | R21: 450 | S21: 450 | T21: 450 | U21: 450 | V21: 700 | W21: 700 | X21: 700 | Y21: 850 | Z21: 850
J22: Gujarat | K22: 75 | L22: 75 | M22: 120 | N22: 120 | O22: 120 | P22: 120 | Q22: 150 | R22: 150 | S22: 150 | T22: 150 | U22: 150 | V22: 250 | W22: 250 | X22: 250 | Y22: 300 | Z22: 300
J23: MH / MP / RAJ | K23: 100 | L23: 100 | M23: 200 | N23: 200 | O23: 200 | P23: 200 | Q23: 250 | R23: 250 | S23: 250 | T23: 250 | U23: 250 | V23: 400 | W23: 400 | X23: 400 | Y23: 450 | Z23: 450
J24: Other State | K24: 130 | L24: 130 | M24: 300 | N24: 300 | O24: 300 | P24: 300 | Q24: 400 | R24: 400 | S24: 400 | T24: 400 | U24: 400 | V24: 500 | W24: 500 | X24: 500 | Y24: 600 | Z24: 600