B2: Album Printing & Accessories | G2: Photo Book | L2: Premium Bag pad | Q2: Packing & Courier
B3: Paper | C3: Quantity | D3: Rate | E3: Amount | G3: Size | H3: Paper | I3: Purc. | J3: Sale | M3: Company Rate | N3: SVD MRP Rate | O3: SVD Profitt | Q3: State | R3: Purc. | S3: Sale
B4: Royal Glossy / Matt | C4: 30 | D4: =VLOOKUP(B4,H4:J13,3,0) -> 30 | E4: =SUM(C4*D4) -> 900 | G4: 8 x 24 | H4: Royal Glossy / Matt | I4: 40 | J4: 30 | L4: Series No. | M4: Photobook | N4: Photobook | O4: Photobook | Q4: Gujarat | S4: 120
B5: Mix Print | C5: 0 | D5: 35 | E5: =SUM(C5*D5) -> 0 | G5: 10 x 28 | H5: NT Glossy / Matt | I5: 47 | J5: 35 | L5: Only Briefcase Printed | M5: 250 | N5: 500 | O5: =SUM(N5-M5) -> 250 | Q5: MH / MP / RJ | S5: 200
B6: TP | C6: 1 | D6: =SUM(D4) -> 30 | E6: =SUM(C6*D6) -> 30 | H6: Royal Velvet | I6: 47 | J6: 38 | L6: Art BagPad-G 1 TO 9 | M6: 350 | N6: 650 | O6: =SUM(N6-M6) -> 300 | Q6: Other State | S6: 400
B7: Making Charge | C7: =IF(AND(C4>0,C4<1000),1,) -> 1 | D7: 350 | E7: =SUM(C7*D7) -> 350 | H7: NT Thick Glossy / Matt | I7: 53 | J7: 40 | L7: Art BoxPad-BF 1 TO 3 | M7: 500 | N7: 800 | O7: =SUM(N7-M7) -> 300
B8: Reg. Emboss | C8: 0 | D8: 170 | E8: =SUM(C8*D8) -> 0 | H8: NT Velvet | I8: 54 | J8: 43 | L8: Art BoxPad-HP 1 TO 3 | M8: 600 | N8: 900 | O8: =SUM(N8-M8) -> 300 | Q8: Theme Book
B9: Meta. Emboss | C9: 0 | D9: 200 | E9: =SUM(C9*D9) -> 0 | H9: NT Thick Velvet | I9: 60 | J9: 48 | L9: Art BagPadBox-SC 1 TO 3 | M9: 700 | N9: 1050 | O9: =SUM(N9-M9) -> 350 | Q9: Gujarat | S9: 75
B10: Minibook | C10: 0 | D10: 250 | E10: =SUM(C10*D10) -> 0 | H10: Luster / Photo Matt | I10: 55 | J10: 80 | L10: Art BagPadBox-EC 1 TO 5 | M10: 900 | N10: 1300 | O10: =SUM(N10-M10) -> 400 | Q10: MH / MP / RJ | S10: 100
B11: Calendar 6 x 8 | C11: 0 | D11: 100 | E11: =SUM(C11*D11) -> 0 | H11: Natural | J11: 50 | L11: Art BagPadBox-FC 1 TO 4 | M11: 900 | N11: 1300 | O11: =SUM(N11-M11) -> 400 | Q11: Other State | S11: 130
B12: 8 x 12 Window Bag | C12: 0 | D12: 250 | E12: =SUM(C12*D12) -> 0 | H12: Pearl Metalic | J12: 100 | L12: Art BagPadBox-FP 1 TO 4 | M12: 1200 | N12: 1700 | O12: =SUM(N12-M12) -> 500
B13: Only Briefcase Printed | C13: 0 | D13: =VLOOKUP(B13,L5:N14,3,0) -> 500 | E13: =SUM(C13*D13) -> 0 | H13: NT / Dual Metalic | J13: 80 | L13: Art Bag/PadBox-DD 1 | M13: 1600 | N13: 2100 | O13: =SUM(N13-M13) -> 500
B14: Gujarat | C14: =IF(AND(C4>0,C4<1000),1,) -> 1 | D14: =VLOOKUP(B14,Q4:S6,3,0) -> 120 | E14: =SUM(C14*D14) -> 120 | L14: Art Bag/PadBox-PW 1 & 2 | M14: 1600 | N14: 2100 | O14: =SUM(N14-M14) -> 500
B15: Theme Book
B16: 4 x 6 | C16: 0 | D16: =VLOOKUP(B16,H32:J34,3,0) -> 5 | E16: =SUM(C16*D16) -> 0
B17: Soft Case Binding | C17: 0 | D17: 50 | E17: =SUM(C17*D17) -> 0
B18: Hard Case Binding | C18: 0 | D18: 200 | E18: =SUM(C18*D18) -> 0
B19: Other State | C19: 0 | D19: =VLOOKUP(B19,Q9:S11,3,0) -> 130 | E19: =SUM(C19*D19) -> 0
E20: =SUM(E4:E19) -> 1400
B21: Total | C21: =SUM(E20) -> 1400 | H21: Reg Emboos | I21: 190 | J21: 250
B22: Disscount | C22: 0. | H22: Metalic Emboss | I22: 200 | J22: 350
B23: Disscount Amount | C23: =SUM(C21*C22) -> 0 | H23: Calendar 6 x 8 | I23: 100 | J23: 15
B24: Final Amount | C24: =SUM(C21-C23) -> 1400 | H24: Repairing Charge | I24: 150 | J24: 350
H25: Minibook | I25: 220 | J25: 350
H26: Making + lether Bag | I26: 200 | J26: 350
H27: E Book | I27: 100 | J27: 150
H28: 8 x 12 Window Bag | I28: 50 | J28: 100
H29: Brifcase with Photo | I29: 300 | J29: 500
H30: Fancy Bag and Box | I30: 500 | J30: 700
H32: 4 x 6 | I32: 4 | J32: 5
H33: 5 x 7 | I33: 6 | J33: 8
H34: 6 x 8 | I34: 16 | J34: 10
H35: Hard Pad | I35: 150 | J35: 200